{
  "contract_version": "1.0.0",
  "source_system": "orders-postgres",
  "source_database": "commerce",
  "source_schema": "public",
  "source_table": "orders",
  "source_contract_id": "orders_source_contract",
  "source_contract_version": "1.0.0",
  "source_contract_digest": "2a7c9746590b17b2e70b103932a0aeb249a54eb287495a198568f9a1fffda199",
  "operation": "update",
  "primary_key": [{"name": "order_id", "type": "string", "value": "o-100"}],
  "before": {"order_id": "o-100", "customer_id": "c-1", "amount": 100, "campaign_id": null},
  "after": {"order_id": "o-100", "customer_id": "c-1", "amount": 125, "campaign_id": null},
  "transaction_id": "tx-900",
  "source_position": {"kind": "postgres_lsn", "value": "16/B374D848"},
  "transaction_sequence": 0,
  "event_sequence": 0,
  "committed_at": "2026-09-20T12:00:00.000000Z",
  "ingested_at": "2026-09-20T12:00:01.000000Z",
  "source_schema_version": "1.0.0",
  "source_schema_digest": "2a7c9746590b17b2e70b103932a0aeb249a54eb287495a198568f9a1fffda199",
  "event_id": "7950f4aa2df54d9ae0d1e9f0c37effd96b0b575cbb0e9d53dc4fd87c02f12ea0",
  "payload_digest": "0266445377dbd704ca41785a96ac2a4b8409bee34b79929633bebf563eedb060",
  "run_id": "run-stage4-local",
  "generation_id": "generation-2026-09-20",
  "transport_capabilities": {"before_images": "full", "transaction_boundaries": true, "source_order": true},
  "quarantine_reason": null
}
